{
  "run_id": "RUN-20260527-001",
  "schema_version": "0.1.0",
  "captured_at": "2026-05-27T13:00:30Z",
  "base_commit": "abc1234",
  "baseline_green": true,
  "commands": [
    {
      "command_array": [
        "pytest",
        "tests/ingestion/"
      ],
      "label": "ingestion_tests",
      "exit_code": 0,
      "passed": true
    },
    {
      "command_array": [
        "ruff",
        "check",
        "."
      ],
      "exit_code": 0,
      "passed": true
    }
  ]
}
